title,id,articles_with_corrections,total_articles,proportion,percentage_with_corrections,title_url
"The Australian Band of Hope Review, and Children's Friend (Sydney, NSW : 1856)",161,58,668,0.08682634730538923,8.682634730538922,http://nla.gov.au/nla.news-title161
"The W.A. Record (Perth, WA : 1888 - 1922)",1086,9430,108105,0.08723000786272606,8.723000786272605,http://nla.gov.au/nla.news-title1086
"The Tasmanian Daily News (Hobart Town, Tas. : 1855 - 1858)",948,1745,20001,0.0872456377181141,8.72456377181141,http://nla.gov.au/nla.news-title948
"The Leader (Liverpool, NSW : 1946 - 1949)",182,282,3230,0.08730650154798762,8.730650154798763,http://nla.gov.au/nla.news-title182
The Bowral Free Press (NSW : 1884),387,137,1565,0.08753993610223643,8.753993610223642,http://nla.gov.au/nla.news-title387
"Bell's Life in Victoria and Sporting Chronicle (Melbourne, Vic. : 1857 - 1868)",959,1667,19039,0.08755711959661747,8.755711959661747,http://nla.gov.au/nla.news-title959
Healesville Guardian and Yarra Glen Advocate (Vic. : 1898),141,64,730,0.08767123287671233,8.767123287671232,http://nla.gov.au/nla.news-title141
Wagga Wagga Express and Murrumbidgee District Advertiser (NSW : 1858 - 1859; 1866; 1872 - 1874),382,1118,12744,0.08772755806654112,8.772755806654112,http://nla.gov.au/nla.news-title382
"The Gippsland Farmers' Journal (Traralgon, Vic. : 1893 - 1896; 1914 - 1918)",296,2254,25637,0.08791980340913523,8.791980340913524,http://nla.gov.au/nla.news-title296
"South Australian Chronicle and Weekly Mail (Adelaide, SA : 1868 - 1881)",288,10564,120008,0.08802746483567762,8.802746483567763,http://nla.gov.au/nla.news-title288
"The West Australian (Perth, WA : 1879 - 1954)",30,296491,3360616,0.08822519442864046,8.822519442864046,http://nla.gov.au/nla.news-title30
Brunswick and Coburg Star (Vic. : 1914 - 1916),780,516,5844,0.08829568788501027,8.829568788501026,http://nla.gov.au/nla.news-title780
"The Queenslander (Brisbane, Qld. : 1866 - 1939)",42,64723,730936,0.08854810817910186,8.854810817910186,http://nla.gov.au/nla.news-title42
"Morwell Advertiser and Weekly Chronicle (Morwell, Vic. : 1887 - 1888)",132,164,1851,0.08860075634792004,8.860075634792004,http://nla.gov.au/nla.news-title132
"The Fremantle Herald (WA : 1913 - 1915, 1919 - 1921)",1116,1162,13098,0.08871583447854635,8.871583447854634,http://nla.gov.au/nla.news-title1116
"The Cumberland Free Press (Parramatta, NSW : 1895 - 1897)",724,1182,13247,0.08922774967917264,8.922774967917265,http://nla.gov.au/nla.news-title724
"The Kiama Independent, and Shoalhaven Advertiser (NSW : 1863 - 1947)",361,19707,220731,0.08928061758429943,8.928061758429944,http://nla.gov.au/nla.news-title361
"The World's News (Sydney, NSW : 1901 - 1955)",466,22269,248908,0.08946679094283831,8.946679094283832,http://nla.gov.au/nla.news-title466
"The Western Champion (Blackall/Barcaldine, Qld. : 1879 - 1891)",265,1314,14646,0.08971732896353954,8.971732896353954,http://nla.gov.au/nla.news-title265
"Centralian Advocate (Alice Springs, NT : 1947 - 1954)",63,2648,29493,0.08978401654629913,8.978401654629913,http://nla.gov.au/nla.news-title63
Inglewood Advertiser (Vic. : 1914 - 1918),570,1181,13136,0.08990560292326431,8.990560292326432,http://nla.gov.au/nla.news-title570
"The Age (Queanbeyan, NSW : 1904 - 1907)",113,1199,13299,0.09015715467328371,9.015715467328372,http://nla.gov.au/nla.news-title113
The Kiama Reporter and Illawarra Journal (NSW : 1899 - 1947),362,6401,70924,0.09025153685635327,9.025153685635328,http://nla.gov.au/nla.news-title362
The Adelaide Express (SA : 1863 - 1866),1092,1976,21838,0.09048447660042129,9.048447660042129,http://nla.gov.au/nla.news-title1092
Gippsland Times (Vic. : 1861 - 1954),108,39651,437211,0.0906907648709662,9.06907648709662,http://nla.gov.au/nla.news-title108
Heidelberg News and Greensborough and Diamond Creek Chronicle (Vic. : 1914 - 1916),324,365,4015,0.09090909090909091,9.090909090909092,http://nla.gov.au/nla.news-title324
Twofold Bay and Maneroo Telegraph (NSW : 1860),478,51,561,0.09090909090909091,9.090909090909092,http://nla.gov.au/nla.news-title478
"Australian Town and Country Journal (Sydney, NSW : 1870 - 1907)",52,44417,484150,0.09174222864814624,9.174222864814624,http://nla.gov.au/nla.news-title52
"The Daily News and Evening Chronicle (Sydney, NSW : 1848)",1469,36,392,0.09183673469387756,9.183673469387756,http://nla.gov.au/nla.news-title1469
"The Bega Standard and Candelo, Merimbula, Pambula, Eden, Wolumla, and General Advertiser (NSW : 1876 - 1884)",720,353,3827,0.09223935197282467,9.223935197282467,http://nla.gov.au/nla.news-title720
The Charleville Courier (Qld. : 1896 - 1898),340,92,997,0.09227683049147442,9.227683049147442,http://nla.gov.au/nla.news-title340
"Blue Mountain Gazette (Katoomba, NSW : 1903 - 1904)",908,298,3227,0.0923458320421444,9.23458320421444,http://nla.gov.au/nla.news-title908
The Burrowa News (NSW : 1874 - 1951),463,18003,194758,0.09243779459637089,9.24377945963709,http://nla.gov.au/nla.news-title463
Illustrated Sydney News (NSW : 1881 - 1894),804,1737,18781,0.09248708801448272,9.248708801448272,http://nla.gov.au/nla.news-title804
Adelaide Times (SA : 1848 - 1858),1100,6014,64909,0.09265279083023925,9.265279083023925,http://nla.gov.au/nla.news-title1100
"Telegraph (Hobart Town, Tas. : 1867)",1250,13,140,0.09285714285714286,9.285714285714286,http://nla.gov.au/nla.news-title1250
"Glengarry, Toongabbie and Cowwarr Journal and Central Gippsland Reporter (Vic. : 1914)",563,278,2986,0.09310113864701942,9.310113864701943,http://nla.gov.au/nla.news-title563
Goulburn Herald (NSW : 1881 - 1907),367,17711,189056,0.09368123730534868,9.368123730534867,http://nla.gov.au/nla.news-title367
"Hobart Town Punch (Hobart Town, Tas. : 1878)",1262,3,32,0.09375,9.375,http://nla.gov.au/nla.news-title1262
Kiama Reporter (NSW : 1886 - 1887),388,131,1378,0.09506531204644413,9.506531204644412,http://nla.gov.au/nla.news-title388
The Walcha News (NSW : 1932 - 1935),962,918,9639,0.09523809523809523,9.523809523809524,http://nla.gov.au/nla.news-title962
Oakleigh and Caulfield Times Mulgrave and Ferntree Gully Guardian (Vic. : 1914 - 1918),304,575,6004,0.09576948700866089,9.576948700866089,http://nla.gov.au/nla.news-title304
"Bowral Free Press and Mittagong, Burrawang and Kangaloon Advocate (NSW : 1883 - 1884)",521,125,1305,0.09578544061302682,9.578544061302683,http://nla.gov.au/nla.news-title521
"Federal Standard (Chiltern, Vic. : 1914 - 1918)",555,953,9933,0.09594281687304942,9.594281687304942,http://nla.gov.au/nla.news-title555
Cobden Times and Heytesbury Advertiser (Vic. : 1914 - 1918),544,2025,20947,0.09667255454241658,9.667255454241658,http://nla.gov.au/nla.news-title544
"Hawkesbury Herald (Windsor, NSW : 1902 - 1945)",179,1276,13136,0.09713763702801462,9.713763702801462,http://nla.gov.au/nla.news-title179
"Hamilton Spectator and Grange District Advertiser (South Melbourne, Vic. : 1860 - 1870)",927,1684,17227,0.09775352644105184,9.775352644105183,http://nla.gov.au/nla.news-title927
Coolgardie Miner (WA : 1913 - 1917),343,1125,11476,0.09803067270826071,9.803067270826071,http://nla.gov.au/nla.news-title343
Koroit Sentinel and Tower Hill Advocate (Vic. : 1914 - 1918),573,621,6323,0.09821287363593231,9.821287363593232,http://nla.gov.au/nla.news-title573
Young Witness (NSW : 1915 - 1923),468,9265,94330,0.09821901833987066,9.821901833987067,http://nla.gov.au/nla.news-title468
"The North Eastern Ensign (Benalla, Vic. : 1872 - 1938)",222,8238,83722,0.09839707603736174,9.839707603736175,http://nla.gov.au/nla.news-title222
"Nashville Times, Gympie and Mary River Mining Gazette (Qld. : 1868)",838,129,1311,0.09839816933638444,9.839816933638444,http://nla.gov.au/nla.news-title838
"The Inquirer and Commercial News (Perth, WA : 1855 - 1901)",180,22561,228445,0.09875900107246821,9.87590010724682,http://nla.gov.au/nla.news-title180
Ouyen Mail and Central Mallee Advertiser (Vic. : 1914 - 1915),306,153,1546,0.09896507115135834,9.896507115135835,http://nla.gov.au/nla.news-title306
Sydney Journal and Daily Advertiser (NSW : 1847),1463,10,101,0.09900990099009901,9.900990099009901,http://nla.gov.au/nla.news-title1463
The Canberra Times (ACT : 1926 - 1995),11,324802,3265491,0.0994649809171117,9.94649809171117,http://nla.gov.au/nla.news-title11
Gilgandra Weekly (NSW : 1942 - 1955),411,3517,35319,0.09957813075115376,9.957813075115377,http://nla.gov.au/nla.news-title411
Adelong and Tumut Express and Tumbarumba Post (NSW : 1900 - 1925),434,3982,39911,0.09977199268372128,9.977199268372129,http://nla.gov.au/nla.news-title434
"Alexandra and Yea Standard, Gobur, Thornton and Acheron Express (Vic. : 1877 - 1908)",155,3897,39005,0.09991026791436995,9.991026791436996,http://nla.gov.au/nla.news-title155
"The Northern Sportsman (Innisfail, Qld. : 1928)",1151,7,70,0.1,10.0,http://nla.gov.au/nla.news-title1151
"Northern Territory Times (Darwin, NT : 1927 - 1932)",36,2283,22775,0.10024149286498353,10.024149286498353,http://nla.gov.au/nla.news-title36
"South Bourke and Mornington Journal (Richmond, Vic. : 1877 - 1920; 1926 - 1927)",208,8429,83739,0.10065799687123085,10.065799687123086,http://nla.gov.au/nla.news-title208
The Church of England Messenger for the Diocese of Melbourne (Vic. : 1869),953,28,278,0.10071942446043165,10.071942446043165,http://nla.gov.au/nla.news-title953
"Heidelberg News and Greensborough, Eltham and Diamond Creek Chronicle (Vic. : 1916 - 1918)",325,326,3221,0.10121080409810618,10.121080409810618,http://nla.gov.au/nla.news-title325
"Commercial Journal and General Advertiser (Sydney, NSW : 1845)",1016,106,1046,0.10133843212237094,10.133843212237094,http://nla.gov.au/nla.news-title1016
Williamstown Advertiser (Vic. : 1914 - 1918),302,887,8731,0.10159202840453556,10.159202840453556,http://nla.gov.au/nla.news-title302
"Australian Band of Hope Journal (Sydney, NSW : 1857 - 1857)",162,48,471,0.10191082802547771,10.191082802547772,http://nla.gov.au/nla.news-title162
Sunshine Advocate (Vic. : 1924 - 1954),251,7565,73987,0.1022476921621366,10.22476921621366,http://nla.gov.au/nla.news-title251
"Critic (Hobart, Tas. : 1892 - 1893)",858,17,166,0.10240963855421686,10.240963855421686,http://nla.gov.au/nla.news-title858
Kiama Independent (NSW : 1947 - 1954),363,2641,25587,0.10321647711728613,10.321647711728613,http://nla.gov.au/nla.news-title363
Windsor and Richmond Gazette (NSW : 1888 - 1961),192,23639,228074,0.10364618501012829,10.36461850101283,http://nla.gov.au/nla.news-title192
Queanbeyan Age and Queanbeyan Observer (NSW : 1915 - 1927),87,4780,46035,0.10383403931791028,10.383403931791028,http://nla.gov.au/nla.news-title87
"Northern Territory Times and Gazette (Darwin, NT : 1873 - 1927)",9,13820,132856,0.10402240019268982,10.402240019268982,http://nla.gov.au/nla.news-title9
"The W.A. Bulletin (Fremantle, WA : 1888 - 1890)",1200,267,2562,0.10421545667447307,10.421545667447308,http://nla.gov.au/nla.news-title1200
"Kilmore Free Press (Kilmore, Vic. : 1870 - 1954)",127,10696,101827,0.10504090270753337,10.504090270753338,http://nla.gov.au/nla.news-title127
The Shipping Gazette and Sydney General Trade List (NSW : 1844 - 1860),690,1839,17437,0.10546538968859322,10.546538968859322,http://nla.gov.au/nla.news-title690
"Victorian Express (Geraldton, WA : 1878 - 1894)",1128,2855,27053,0.1055335822274794,10.55335822274794,http://nla.gov.au/nla.news-title1128
Rutherglen Sun and Chiltern Valley Advertiser (Vic. : 1914 - 1918),604,3439,32577,0.1055652761150505,10.55652761150505,http://nla.gov.au/nla.news-title604
"Kooweerup Sun, Lang Lang Guardian and Cranbourne Shire Record (Vic. : 1918)",572,79,748,0.10561497326203209,10.56149732620321,http://nla.gov.au/nla.news-title572
Dungog Chronicle : Durham and Gloucester Advertiser (NSW : 1894 - 1954),643,42592,399654,0.10657218493997307,10.657218493997307,http://nla.gov.au/nla.news-title643
"Western Champion (Parkes, NSW : 1898 - 1934)",459,20980,196844,0.10658186177887058,10.658186177887059,http://nla.gov.au/nla.news-title459
"Hawkesbury Chronicle and Farmers Advocate (Windsor, NSW : 1881 - 1888)",177,730,6844,0.10666277030976037,10.666277030976037,http://nla.gov.au/nla.news-title177
"Tribune (SA edition, published in Sydney : 1951 - 1964)",1486,378,3534,0.10696095076400679,10.69609507640068,http://nla.gov.au/nla.news-title1486
"The Star and Working Man's Guardian (Parramatta, NSW : 1844 - 1845)",1031,107,996,0.10742971887550201,10.742971887550201,http://nla.gov.au/nla.news-title1031
Kapunda Herald and Northern Intelligencer (SA : 1864 - 1878),399,2342,21798,0.10744104963758143,10.744104963758144,http://nla.gov.au/nla.news-title399
Examiner (SA : 1853),1337,52,482,0.1078838174273859,10.78838174273859,http://nla.gov.au/nla.news-title1337
The Brisbane Courier (Qld. : 1864 - 1933),16,324039,2986375,0.10850579716211126,10.850579716211126,http://nla.gov.au/nla.news-title16
Good Neighbour (ACT : 1950 - 1969),871,712,6499,0.10955531620249269,10.95553162024927,http://nla.gov.au/nla.news-title871
Queanbeyan-Canberra Advocate (NSW : 1905 - 1927),119,361,3273,0.1102963641918729,11.02963641918729,http://nla.gov.au/nla.news-title119
"The Pictorial Australian (Adelaide, SA : 1885 - 1895)",1147,707,6406,0.11036528254761162,11.036528254761162,http://nla.gov.au/nla.news-title1147
The Bega Gazette and Eden District or Southern Coast Advertiser (NSW : 1865 - 1899),392,2015,18252,0.1103988603988604,11.03988603988604,http://nla.gov.au/nla.news-title392
"Queensland Figaro (Brisbane, Qld. : 1883 - 1885)",338,665,6007,0.11070417845846513,11.070417845846512,http://nla.gov.au/nla.news-title338
"Alexandra Standard and Yarck, Gobur, Thornton, Taggerty and Acheron Express (Vic. : 1949 - 1954)",157,597,5385,0.11086350974930362,11.086350974930362,http://nla.gov.au/nla.news-title157
Launceston Examiner (Tas. : 1842 - 1899),74,72119,650099,0.11093541137580584,11.093541137580583,http://nla.gov.au/nla.news-title74
"The St. James and Devenish Herald (Dookie, Vic. : 1905)",1281,8,72,0.1111111111111111,11.11111111111111,http://nla.gov.au/nla.news-title1281
"Army News (Darwin, NT : 1941 - 1946)",47,6493,58384,0.11121197588380378,11.121197588380378,http://nla.gov.au/nla.news-title47
The Port Phillip Patriot and Morning Advertiser (Vic. : 1845 - 1848),937,1805,16209,0.11135788759331236,11.135788759331236,http://nla.gov.au/nla.news-title937
"The Elsternwick Leader and District Record (Brighton, Vic. : 1887 - 1888)",198,94,844,0.11137440758293839,11.137440758293838,http://nla.gov.au/nla.news-title198
"South Australian Weekly Chronicle (Adelaide, SA : 1858 - 1867)",287,6913,62017,0.11146943579986132,11.146943579986132,http://nla.gov.au/nla.news-title287
The Melbourne Leader (Vic. : 1861),958,246,2204,0.11161524500907441,11.161524500907442,http://nla.gov.au/nla.news-title958
Dalby Herald and Western Queensland Advertiser (Qld. : 1866 - 1879),1062,2047,18296,0.11188237866200262,11.188237866200263,http://nla.gov.au/nla.news-title1062
Sydney Mail (NSW : 1860 - 1871),697,5439,48535,0.1120634593592253,11.206345935922531,http://nla.gov.au/nla.news-title697
The Tumut Advocate and Farmers and Settlers' Adviser (NSW : 1903 - 1925),455,2846,25373,0.1121664761754621,11.21664761754621,http://nla.gov.au/nla.news-title455
"The Austral-Asiatic Review, Tasmanian and Australian Advertiser (Hobart Town, Tas. : 1837 - 1844)",1232,812,7239,0.1121701892526592,11.21701892526592,http://nla.gov.au/nla.news-title1232
Kerang Times and Swan Hill Gazette (Vic. : 1877 - 1889),195,3483,30949,0.11253998513683802,11.253998513683802,http://nla.gov.au/nla.news-title195
"Advertiser (Hurstbridge, Vic. : 1922 - 1939)",148,4972,43915,0.11321871797791187,11.321871797791188,http://nla.gov.au/nla.news-title148
"Healesville Guardian (Lilydale, Vic. : 1942 - 1954)",144,1499,13225,0.11334593572778828,11.334593572778829,http://nla.gov.au/nla.news-title144
"The Australian Home Companion and Band of Hope Journal (Sydney, NSW : 1859 - 1861)",164,191,1670,0.11437125748502994,11.437125748502993,http://nla.gov.au/nla.news-title164
"The Britannia and Trades' Advocate (Hobart Town, Tas. : 1846 - 1851)",941,947,8270,0.11451027811366385,11.451027811366385,http://nla.gov.au/nla.news-title941
"The Possum (Perth, WA : 1887 - 1888)",1199,78,677,0.11521418020679468,11.521418020679468,http://nla.gov.au/nla.news-title1199
South Australian Record and Australasian and South African Chronicle (SA : 1840 - 1841),1331,114,984,0.11585365853658537,11.585365853658537,http://nla.gov.au/nla.news-title1331
"South Australian Register (Adelaide, SA : 1839 - 1900)",41,149011,1284820,0.1159781136657275,11.59781136657275,http://nla.gov.au/nla.news-title41
Donald Times (Vic. : 1915 - 1918),552,988,8490,0.11637220259128386,11.637220259128386,http://nla.gov.au/nla.news-title552
"The Australian Communist (Sydney, NSW : 1920 - 1921)",995,53,455,0.11648351648351649,11.648351648351648,http://nla.gov.au/nla.news-title995
South Australian Free Press (SA : 1853 - 1854),1339,55,472,0.11652542372881355,11.652542372881355,http://nla.gov.au/nla.news-title1339
Geraldton Guardian and Express (WA : 1929 - 1947),220,20268,173556,0.11678075088155984,11.678075088155984,http://nla.gov.au/nla.news-title220
Illustrated Sydney News and New South Wales Agriculturalist and Grazier (NSW : 1872 - 1881),803,786,6697,0.11736598476929969,11.736598476929968,http://nla.gov.au/nla.news-title803
Sydney Free Press (NSW : 1841 - 1842),1015,303,2576,0.11762422360248448,11.762422360248447,http://nla.gov.au/nla.news-title1015
Warwick Argus and Tenterfield Chronicle (Qld. : 1866 - 1879),260,1183,10024,0.1180167597765363,11.80167597765363,http://nla.gov.au/nla.news-title260
"Independent (Footscray, Vic. : 1883 - 1922)",231,7542,63627,0.11853458437455797,11.853458437455796,http://nla.gov.au/nla.news-title231
"The Sunday Mirror (Perth, WA : 1920 - 1921)",255,390,3283,0.1187937861711849,11.87937861711849,http://nla.gov.au/nla.news-title255
Eden Free Press and Eden District Advertiser (NSW : 1899),480,60,503,0.11928429423459244,11.928429423459244,http://nla.gov.au/nla.news-title480
Mercury and Weekly Courier (Vic. : 1878 - 1903),123,3357,27843,0.1205689042129081,12.05689042129081,http://nla.gov.au/nla.news-title123
"The Essendon Gazette and Keilor, Bulla and Broadmeadows Reporter (Moonee Ponds, Vic. : 1914 - 1918)",242,2319,19138,0.12117253631518445,12.117253631518444,http://nla.gov.au/nla.news-title242
"The Australian, Windsor, Richmond, and Hawkesbury Advertiser (NSW : 1873 - 1899)",184,659,5387,0.12233153888992018,12.233153888992017,http://nla.gov.au/nla.news-title184
Parramatta Chronicle and Cumberland General Advertiser (NSW : 1843 - 1845),1018,216,1753,0.12321734169994296,12.321734169994295,http://nla.gov.au/nla.news-title1018
"The Banner (Melbourne, Vic. : 1853 - 1854)",805,665,5381,0.12358297714179521,12.358297714179521,http://nla.gov.au/nla.news-title805
"North Australian (Darwin, NT : 1883 - 1889)",80,1045,8397,0.12444920805049423,12.444920805049422,http://nla.gov.au/nla.news-title80
The Moree Examiner and General Advertiser (NSW : 1899),887,40,321,0.12461059190031153,12.461059190031152,http://nla.gov.au/nla.news-title887
"The Colonial Observer (Sydney, NSW : 1841 - 1844)",1012,554,4443,0.12469052442043664,12.469052442043663,http://nla.gov.au/nla.news-title1012
Portland Guardian and Normanby General Advertiser (Vic. : 1842 - 1843; 1854 - 1876),110,7385,58933,0.1253117947499703,12.531179474997032,http://nla.gov.au/nla.news-title110
"The Wooroora Producer (Balaklava, SA : 1909 - 1940)",1098,8161,65123,0.1253167083825991,12.53167083825991,http://nla.gov.au/nla.news-title1098
"Clarence and Richmond Examiner and New England Advertiser (Grafton, NSW : 1859 - 1889)",65,12762,101097,0.12623519985756254,12.623519985756253,http://nla.gov.au/nla.news-title65
"Woroni (Canberra, ACT : 1950 - 2007)",666,2741,21633,0.1267045717191328,12.670457171913279,http://nla.gov.au/nla.news-title666
The Port Adelaide Gazette (SA : 1930),718,149,1173,0.12702472293265132,12.702472293265131,http://nla.gov.au/nla.news-title718
"Nepean Times (Penrith, NSW : 1882 - 1962)",350,40103,314404,0.1275524484421318,12.755244844213179,http://nla.gov.au/nla.news-title350
"Hobarton Guardian, or, True Friend of Tasmania (Hobart, Tas. : 1847 - 1854)",864,1754,13729,0.12775875883167018,12.775875883167018,http://nla.gov.au/nla.news-title864
Queanbeyan Age (NSW : 1867 - 1904),84,8524,66687,0.12782101459054987,12.782101459054987,http://nla.gov.au/nla.news-title84
"Logan Witness (Beenleigh, Qld. : 1878 - 1893)",850,1884,14654,0.12856557936399618,12.856557936399618,http://nla.gov.au/nla.news-title850
"Sydney General Trade List, and Mercantile Advertiser (NSW : 1829 - 1830)",695,31,241,0.12863070539419086,12.863070539419086,http://nla.gov.au/nla.news-title695
Bell's Life in Sydney and Sporting Chronicle (NSW : 1860 - 1870),57,2395,18524,0.12929172964802418,12.929172964802419,http://nla.gov.au/nla.news-title57
Benalla Ensign (Vic. : 1938 - 1954),216,6937,53625,0.12936130536130536,12.936130536130536,http://nla.gov.au/nla.news-title216
"The Tasmanian Colonist (Hobart Town, Tas. : 1851 - 1855)",1041,1239,9569,0.12948061448427212,12.948061448427211,http://nla.gov.au/nla.news-title1041
The Kiama Independent and Illawarra and Shoalhaven Advertiser (NSW : 1863),360,74,570,0.12982456140350876,12.982456140350877,http://nla.gov.au/nla.news-title360
"Illustrated Australian News (Melbourne, Vic. : 1890 - 1896)",71,197,1514,0.13011889035667107,13.011889035667107,http://nla.gov.au/nla.news-title71
"The Magnet Mirror and Murchison Reflector (Meekatharra, WA : 1928 - 1935)",1275,3622,27815,0.13021750853855832,13.021750853855831,http://nla.gov.au/nla.news-title1275
"The South Australian Advertiser (Adelaide, SA : 1858 - 1889)",7,57939,444692,0.13029017837064755,13.029017837064755,http://nla.gov.au/nla.news-title7
Williamstown Chronicle (Vic. : 1856 - 1954),193,19913,152694,0.13041114909557677,13.041114909557677,http://nla.gov.au/nla.news-title193
Eltham and Whittlesea Shires Advertiser (Vic. : 1940 - 1942),149,848,6499,0.1304816125557778,13.048161255577782,http://nla.gov.au/nla.news-title149
"Western Argus (Kalgoorlie, WA : 1894 - 1896)",99,192,1460,0.13150684931506848,13.150684931506849,http://nla.gov.au/nla.news-title99
Mullewa Magnet and Perenjori-Morawa Advertiser (WA : 1927 - 1931),1427,2203,16731,0.13167174705636245,13.167174705636246,http://nla.gov.au/nla.news-title1427
The Newcastle Chronicle (NSW : 1866 - 1876),354,5301,39926,0.1327706256574663,13.27706256574663,http://nla.gov.au/nla.news-title354
"The Temperance Advocate and Australasian Commercial and Agricultural Intelligencer (Sydney, NSW : 1840 - 1841)",1037,160,1200,0.13333333333333333,13.333333333333334,http://nla.gov.au/nla.news-title1037
"The Star (Sydney, NSW : 1845 - 1846)",1032,48,360,0.13333333333333333,13.333333333333334,http://nla.gov.au/nla.news-title1032
The Sydney Morning Herald (NSW : 1842 - 1954),35,775663,5799624,0.13374367027931466,13.374367027931466,http://nla.gov.au/nla.news-title35
"Group Settlement Chronicle and Margaret-Augusta Mail (Busselton, WA : 1923 - 1930)",1274,1333,9939,0.13411812053526512,13.411812053526512,http://nla.gov.au/nla.news-title1274
"The Band of Hope Journal and Australian Home Companion (Sydney, NSW : 1858)",163,65,482,0.13485477178423236,13.485477178423237,http://nla.gov.au/nla.news-title163
"North Australian and Queensland General Advertiser (Ipswich, Qld. : 1862 - 1863)",263,679,4983,0.13626329520369254,13.626329520369254,http://nla.gov.au/nla.news-title263
"Traralgon Record and Morwell, Mirboo,Toongabbie, Heyfield,Tyers and Callignee Advertiser (Traralgon, Vic. : 1883 - 1886)",134,428,3139,0.13634915578209622,13.634915578209622,http://nla.gov.au/nla.news-title134
"The Examiner (Sydney, NSW : 1845)",1017,41,298,0.13758389261744966,13.758389261744966,http://nla.gov.au/nla.news-title1017
The Warialda Watchman (NSW : 1899),1160,40,288,0.1388888888888889,13.88888888888889,http://nla.gov.au/nla.news-title1160
Wangaratta Chronicle (Vic. : 1914 - 1918),301,3399,24465,0.1389331698344574,13.89331698344574,http://nla.gov.au/nla.news-title301
"Commercial Journal and Advertiser (Sydney, NSW : 1835 - 1840)",1013,1178,8449,0.1394247839981063,13.942478399810629,http://nla.gov.au/nla.news-title1013
Maryborough and Dunolly Advertiser (Vic. : 1857 - 1867 ; 1914 - 1918),317,9268,66436,0.13950267927027515,13.950267927027515,http://nla.gov.au/nla.news-title317
The Sydney Record (NSW : 1843 - 1844),1034,74,528,0.14015151515151514,14.015151515151514,http://nla.gov.au/nla.news-title1034
"Express (Granville, NSW : 1933 - 1935)",1321,17,121,0.14049586776859505,14.049586776859504,http://nla.gov.au/nla.news-title1321
"The Sentinel (Sydney, NSW : 1845 - 1848)",1029,602,4279,0.14068707641972422,14.068707641972422,http://nla.gov.au/nla.news-title1029
"The Dawn (Sydney, NSW : 1888 - 1905)",252,1509,10711,0.140883204182616,14.088320418261599,http://nla.gov.au/nla.news-title252
"Tasmanian Weekly Dispatch (Hobart Town, Tas. : 1839 - 1841)",1231,239,1693,0.14116952155936208,14.116952155936207,http://nla.gov.au/nla.news-title1231
"The Darling Downs Gazette and General Advertiser (Toowoomba, Qld. : 1858 - 1880)",257,9243,65268,0.1416161059018202,14.16161059018202,http://nla.gov.au/nla.news-title257
Cobden Times (Vic. : 1918),543,177,1240,0.14274193548387096,14.274193548387096,http://nla.gov.au/nla.news-title543
The Ararat Advertiser (Vic. : 1914 - 1918),229,4909,34373,0.14281558199749803,14.281558199749803,http://nla.gov.au/nla.news-title229
Malvern and Caulfield Standard (Vic. : 1906),168,22,154,0.14285714285714285,14.285714285714285,http://nla.gov.au/nla.news-title168
"The Argus (Melbourne, Vic. : 1848 - 1957)",13,743286,5182256,0.1434290393990571,14.34290393990571,http://nla.gov.au/nla.news-title13
"The New South Wales Examiner (Sydney, NSW : 1842)",1026,195,1358,0.14359351988217967,14.359351988217966,http://nla.gov.au/nla.news-title1026
The Melbourne Daily News (Vic. : 1848 - 1851),939,2207,15329,0.1439754713288538,14.39754713288538,http://nla.gov.au/nla.news-title939
