title_id,full_title,title,place,dates,capture_date,capture_timestamp
229,Ararat Advertiser (Vic. : 1914 - 1918),Ararat Advertiser,VIC,1914 - 1918,2013-05-09,20130509163111
13,"Argus (Melbourne, Vic. : 1848 - 1957)",Argus,"Melbourne, VIC",1848 - 1957,2013-05-09,20130509163111
414,Argyle Liberal and District Recorder (NSW : 1903 - 1930),Argyle Liberal and District Recorder,NSW,1903 - 1930,2013-05-09,20130509163111
528,"Arrow (Sydney, NSW : 1896 - 1912)",Arrow,"Sydney, NSW",1896 - 1912,2013-05-09,20130509163111
439,"Arrow (Sydney, NSW : 1916 - 1933)",Arrow,"Sydney, NSW",1916 - 1933,2013-05-09,20130509163111
185,Ballarat Star (Vic. : 1865 - 1869),Ballarat Star,VIC,1865 - 1869,2013-05-09,20130509163111
443,Bega Budget (NSW : 1905 - 1921),Bega Budget,NSW,1905 - 1921,2013-05-09,20130509163111
391,Bega Gazette and County of Auckland Advertiser (NSW : 1865),Bega Gazette and County of Auckland Advertiser,NSW,1865,2013-05-09,20130509163111
392,Bega Gazette and Eden District or Southern Coast Advertiser (NSW : 1865 - 1899),Bega Gazette and Eden District or Southern Coast Advertiser,NSW,1865 - 1899,2013-05-09,20130509163111
472,Braidwood Dispatch and Mining Journal (NSW : 1888 - 1954),Braidwood Dispatch and Mining Journal,NSW,1888 - 1954,2013-05-09,20130509163111
463,Burrowa News (NSW : 1874 - 1951),Burrowa News,NSW,1874 - 1951,2013-05-09,20130509163111
446,Byron Bay Record (NSW : 1902 - 1924),Byron Bay Record,NSW,1902 - 1924,2013-05-09,20130509163111
483,Campbelltown Herald (NSW : 1880 - 1919),Campbelltown Herald,NSW,1880 - 1919,2013-05-09,20130509163111
166,Canberra Community News (ACT : 1925 - 1927),Canberra Community News,ACT,1925 - 1927,2013-05-09,20130509163111
427,Canowindra Star and Eugowra News (NSW : 1910 - 1922),Canowindra Star and Eugowra News,NSW,1910 - 1922,2013-05-09,20130509163111
475,Carcoar Chronicle (NSW : 1863 - 1943),Carcoar Chronicle,NSW,1863 - 1943,2013-05-09,20130509163111
447,Catholic Press (NSW : 1895 - 1942),Catholic Press,NSW,1895 - 1942,2013-05-09,20130509163111
429,Cessnock Eagle and South Maitland Recorder (NSW : 1913 - 1954),Cessnock Eagle and South Maitland Recorder,NSW,1913 - 1954,2013-05-09,20130509163111
448,Cobar Herald (NSW : 1899 - 1914),Cobar Herald,NSW,1899 - 1914,2013-05-09,20130509163111
393,Cobargo Chronicle (NSW : 1898 - 1944),Cobargo Chronicle,NSW,1898 - 1944,2013-05-09,20130509163111
473,Corowa Chronicle (NSW : 1905 - 1928),Corowa Chronicle,NSW,1905 - 1928,2013-05-09,20130509163111
420,Cowra Free Press (NSW : 1911 - 1921),Cowra Free Press,NSW,1911 - 1921,2013-05-09,20130509163111
432,"Daily Observer (Tamworth, NSW : 1917 - 1920)",Daily Observer,"Tamworth, NSW",1917 - 1920,2013-05-09,20130509163111
440,"Democrat (Lithgow, NSW : 1915 - 1916)",Democrat,"Lithgow, NSW",1915 - 1916,2013-05-09,20130509163111
480,Eden Free Press and Eden District Advertiser (NSW : 1899),Eden Free Press and Eden District Advertiser,NSW,1899,2013-05-09,20130509163111
381,"Examiner (Kiama, NSW : 1859 - 1862)",Examiner,"Kiama, NSW",1859 - 1862,2013-05-09,20130509163111
421,Forbes Advocate (NSW : 1911 - 1921),Forbes Advocate,NSW,1911 - 1921,2013-05-09,20130509163111
422,Forbes Times (NSW : 1912 - 1920),Forbes Times,NSW,1912 - 1920,2013-05-09,20130509163111
464,"Freeman's Journal (Sydney, NSW : 1850 - 1932)",Freeman's Journal,"Sydney, NSW",1850 - 1932,2013-05-09,20130509163111
409,Gilgandra Weekly (NSW : 1915 - 1929),Gilgandra Weekly,NSW,1915 - 1929,2013-05-09,20130509163111
411,Gilgandra Weekly (NSW : 1942 - 1955),Gilgandra Weekly,NSW,1942 - 1955,2013-05-09,20130509163111
410,Gilgandra Weekly and Castlereagh (NSW : 1929 - 1941),Gilgandra Weekly and Castlereagh,NSW,1929 - 1941,2013-05-09,20130509163111
484,Gippsland Guardian (Vic : 1855 - 1868),Gippsland Guardian,VIC,1855 - 1868,2013-05-09,20130509163111
357,"Globe (Sydney, NSW : 1885 - 1887)",Globe,"Sydney, NSW",1885 - 1887,2013-05-09,20130509163111
358,"Globe (Sydney, NSW : 1911 - 1914)",Globe,"Sydney, NSW",1911 - 1914,2013-05-09,20130509163111
359,"Globe and Sunday Times War Pictorial (Sydney, NSW : 1914 - 1917)",Globe and Sunday Times War Pictorial,"Sydney, NSW",1914 - 1917,2013-05-09,20130509163111
368,Goulburn Evening Penny Post (NSW : 1881 - 1940),Goulburn Evening Penny Post,NSW,1881 - 1940,2013-05-09,20130509163111
369,Goulburn Evening Post (NSW : 1940 - 1957),Goulburn Evening Post,NSW,1940 - 1957,2013-05-09,20130509163111
365,Goulburn Herald (NSW : 1860 - 1864),Goulburn Herald,NSW,1860 - 1864,2013-05-09,20130509163111
367,Goulburn Herald (NSW : 1881 - 1908),Goulburn Herald,NSW,1881 - 1908,2013-05-09,20130509163111
366,Goulburn Herald and Chronicle (NSW : 1864 - 1881),Goulburn Herald and Chronicle,NSW,1864 - 1881,2013-05-09,20130509163111
364,Goulburn Herald and County of Argyle Advertiser (NSW : 1848 - 1859),Goulburn Herald and County of Argyle Advertiser,NSW,1848 - 1859,2013-05-09,20130509163111
386,"Herald (Fremantle, WA : 1867 - 1886)",Herald,"Fremantle, WA",1867 - 1886,2013-05-09,20130509163111
477,"Independent (Deniliquin, NSW : 1901 - 1946)",Independent,"Deniliquin, NSW",1901 - 1946,2013-05-09,20130509163111
352,"Irrigation Record (Leeton, NSW : 1913 - 1917)",Irrigation Record,"Leeton, NSW",1913 - 1917,2013-05-09,20130509163111
380,Kiama Examiner (NSW : 1858 - 1859),Kiama Examiner,NSW,1858 - 1859,2013-05-09,20130509163111
363,Kiama Independent (NSW : 1947 - 1954),Kiama Independent,NSW,1947 - 1954,2013-05-09,20130509163111
361,"Kiama Independent, and Shoalhaven Advertiser (NSW : 1863 - 1947)","Kiama Independent, and Shoalhaven Advertiser",NSW,1863 - 1947,2013-05-09,20130509163111
388,Kiama Reporter (NSW: 1886 - 1887),Kiama Reporter,NSW,1886 - 1887,2013-05-09,20130509163111
362,Kiama Reporter and Illawarra Journal (NSW : 1899 - 1947),Kiama Reporter and Illawarra Journal,NSW,1899 - 1947,2013-05-09,20130509163111
509,"Labor News (Sydney, NSW : 1918 - 1924)",Labor News,"Sydney, NSW",1918 - 1924,2013-05-09,20130509163111
470,"Land (Sydney, NSW : 1911 - 1954)",Land,"Sydney, NSW",1911 - 1954,2013-05-09,20130509163111
423,"Leader (Orange, NSW : 1912 - 1922)",Leader,"Orange, NSW",1912 - 1922,2013-05-09,20130509163111
438,"Mirror of Australia (Sydney, NSW : 1915 - 1917)",Mirror of Australia,"Sydney, NSW",1915 - 1917,2013-05-09,20130509163111
424,Molong Argus (NSW : 1909 - 1921),Molong Argus,NSW,1909 - 1921,2013-05-09,20130509163111
425,Molong Express and Western District Advertiser (NSW : 1912 - 1922),Molong Express and Western District Advertiser,NSW,1912 - 1922,2013-05-09,20130509163111
431,Narandera Argus and Riverina Advertiser (NSW : 1893 - 1953),Narandera Argus and Riverina Advertiser,NSW,1893 - 1953,2013-05-09,20130509163111
430,Narromine News and Trangie Advocate (NSW : 1898 - 1956),Narromine News and Trangie Advocate,NSW,1898 - 1956,2013-05-09,20130509163111
513,Newcastle Argus and District Advertiser (NSW : 1916),Newcastle Argus and District Advertiser,NSW,1916,2013-05-09,20130509163111
437,"Newsletter: an Australian Paper for Australian People (Sydney, NSW : 1900 -1918)",Newsletter: an Australian Paper for Australian People,"Sydney, NSW",1900 - 1918,2013-05-09,20130509163111
385,North Melbourne Courier and West Melbourne Advertiser (Vic. : 1895 - 1913),North Melbourne Courier and West Melbourne Advertiser,VIC,1895 - 1913,2013-05-09,20130509163111
384,North Melbourne Gazette (Vic. : 1894 - 1901),North Melbourne Gazette,VIC,1894 - 1901,2013-05-09,20130509163111
433,"Northern Daily Leader (Tamworth, NSW : 1921)",Northern Daily Leader,"Tamworth, NSW",1921,2013-05-09,20130509163111
326,"Ovens and Murray Advertiser (Beechworth, Vic. : 1857 - 1918)",Ovens and Murray Advertiser,"Beechworth, VIC",1857 - 1918,2013-05-09,20130509163111
514,Peak Hill Express (NSW : 1902 - 1952),Peak Hill Express,NSW,1902 - 1952,2013-05-09,20130509163111
516,Port Macquarie News and Hastings River Advocate (NSW : 1882 - 1950),Port Macquarie News and Hastings River Advocate,NSW,1882 - 1950,2013-05-09,20130509163111
517,Queanbeyan Leader (NSW : 1905 - 1916),Queanbeyan Leader,NSW,1905 - 1916,2013-05-09,20130509163111
248,"Record (Emerald Hill, Vic : 1868 - 1918)",Record,"Emerald Hill, VIC",1868 - 1918,2013-05-09,20130509163111
428,Record and Emerald Hill and Sandridge Advertiser (Vic. : 1872 - 1881),Record and Emerald Hill and Sandridge Advertiser,VIC,1872 - 1881,2013-05-09,20130509163111
389,"Reporter and Illawarra Journal (Kiama, NSW: 1887 - 1894)",Reporter and Illawarra Journal,"Kiama, NSW",1887 - 1894,2013-05-09,20130509163111
311,"Riverine Herald (Echuca, Vic. ; Moama, NSW : 1869 - 1954)",Riverine Herald,"Echuca, Vic. ; Moama, NSW",1869 - 1954,2013-05-09,20130509163111
334,"Seymour Express and Goulburn Valley Avenel, Graytown, Nagambie, Tallarook and Yea Advertiser (Vic. : 1914 - 1918)","Seymour Express and Goulburn Valley Avenel, Graytown, Nagambie, Tallarook and Yea Advertiser",VIC,1914 - 1918,2013-05-09,20130509163111
520,"Shoalhaven News, Nowra (NSW : 1937)","Shoalhaven News, Nowra",NSW,1937,2013-05-09,20130509163111
416,"Southern Argus (Goulburn, NSW : 1881 - 1885)",Southern Argus,"Goulburn, NSW",1881 - 1885,2013-05-09,20130509163111
418,Southern Morning Herald (NSW : 1920 -1923),Southern Morning Herald,NSW,1920 - 1923,2013-05-09,20130509163111
375,Sunday Mail (Brisbane) (Qld. : 1926 - 1954),Sunday Mail,Brisbane) (QLD,1926 - 1954,2013-05-09,20130509163111
383,"Telegraph, St Kilda, Prahran and South Yarra Guardian (Vic. : 1866 - 1888)","Telegraph, St Kilda, Prahran and South Yarra Guardian",VIC,1866 - 1888,2013-05-09,20130509163111
394,Twofold Bay and Maneroo Observer (NSW : 1860 - 1899),Twofold Bay and Maneroo Observer,NSW,1860 - 1899,2013-05-09,20130509163111
478,Twofold Bay and Maneroo Telegraph (NSW : 1860),Twofold Bay and Maneroo Telegraph,NSW,1860,2013-05-09,20130509163111
479,Twofold Bay Telegraph (NSW : 1860),Twofold Bay Telegraph,NSW,1860,2013-05-09,20130509163111
413,Wagga Wagga Advertiser (NSW : 1874 - 1905),Wagga Wagga Advertiser,NSW,1874 - 1905,2013-05-09,20130509163111
412,Wagga Wagga Advertiser and Riverine Reporter (NSW : 1868 - 1874),Wagga Wagga Advertiser and Riverine Reporter,NSW,1868 - 1874,2013-05-09,20130509163111
382,Wagga Wagga Express and Murrumbidgee District Advertiser (NSW : 1858 - 1875),Wagga Wagga Express and Murrumbidgee District Advertiser,NSW,1858 - 1875,2013-05-09,20130509163111
419,Werriwa Times and Goulburn District News (NSW : 1901),Werriwa Times and Goulburn District News,NSW,1901,2013-05-09,20130509163111
426,Western Herald (NSW : 1896 - 1970),Western Herald,NSW,1896 - 1970,2013-05-09,20130509163111
408,"Western Star (Roma) (Toowoomba, Qld. : 1948 - 1954)",Western Star,"Roma) (Toowoomba, QLD",1948 - 1954,2013-05-09,20130509163111
374,"Western Star and Roma Advertiser (Toowoomba, Qld. : 1875 - 1948)",Western Star and Roma Advertiser,"Toowoomba, QLD",1875 - 1948,2013-05-09,20130509163111
390,"Yarragon, Trafalgar & Moe Settlement News (Vic. : 1902 - 1922)","Yarragon, Trafalgar & Moe Settlement News",VIC,1902 - 1922,2013-05-09,20130509163111
625,Adelong and Tumut Express (NSW : 1925),Adelong and Tumut Express,NSW,1925,2013-10-06,20131006082228
533,Alpine Observer and North-Eastern Herald (Vic. : 1916 - 1918),Alpine Observer and North-Eastern Herald,VIC,1916 - 1918,2013-10-06,20131006082228
534,Ballan Times  (Vic. : 1914 - 1918),Ballan Times,VIC,1914 - 1918,2013-10-06,20131006082228
185,Ballarat Star (Vic. : 1865 - 1870),Ballarat Star,VIC,1865 - 1870,2013-10-06,20131006082228
471,Bathurst Post (NSW : 1881 - 1922),Bathurst Post,NSW,1881 - 1922,2013-10-06,20131006082228
482,Bathurst Times (NSW : 1909 - 1925),Bathurst Times,NSW,1909 - 1925,2013-10-06,20131006082228
535,Berringa Herald (Vic. : 1914 - 1918),Berringa Herald,VIC,1914 - 1918,2013-10-06,20131006082228
536,Birchip Advertiser and Watchem Sentinel (Vic. : 1914 - 1918),Birchip Advertiser and Watchem Sentinel,VIC,1914 - 1918,2013-10-06,20131006082228
444,Blue Mountain Echo (NSW : 1909 - 1928),Blue Mountain Echo,NSW,1909 - 1928,2013-10-06,20131006082228
462,Boorowa News (NSW : 1951 - 1954),Boorowa News,NSW,1951 - 1954,2013-10-06,20131006082228
445,"Border Morning Mail and Riverina Times (Albury, NSW : 1903 - 1920)",Border Morning Mail and Riverina Times,"Albury, NSW",1903 - 1920,2013-10-06,20131006082228
523,Bowral and Robertson Free Press (NSW : 1901),Bowral and Robertson Free Press,NSW,1901,2013-10-06,20131006082228
387,Bowral Free Press (NSW : 1884),Bowral Free Press,NSW,1884,2013-10-06,20131006082228
524,Bowral Free Press (NSW : 1901 - 1906),Bowral Free Press,NSW,1901 - 1906,2013-10-06,20131006082228
522,Bowral Free Press and Berrima District Intelligencer (NSW : 1884 - 1901),Bowral Free Press and Berrima District Intelligencer,NSW,1884 - 1901,2013-10-06,20131006082228
521,"Bowral Free Press and Mittagong, Burrawang and Kangaloon Advocate (NSW : 1883 - 1884)","Bowral Free Press and Mittagong, Burrawang and Kangaloon Advocate",NSW,1883 - 1884,2013-10-06,20131006082228
485,Braidwood Review and District Advocate (NSW : 1915 - 1954),Braidwood Review and District Advocate,NSW,1915 - 1954,2013-10-06,20131006082228
293,Brunswick & Coburg Leader (Vic. : 1914 - 1918),Brunswick & Coburg Leader,VIC,1914 - 1918,2013-10-06,20131006082228
538,Bruthen and Tambo Times (Vic. : 1914 - 1918),Bruthen and Tambo Times,VIC,1914 - 1918,2013-10-06,20131006082228
539,Bunyip Free Press and Berwick Shire Guardian (Vic. : 1914 - 1915),Bunyip Free Press and Berwick Shire Guardian,VIC,1914 - 1915,2013-10-06,20131006082228
540,Castlemaine Mail (Vic. : 1917 - 1918),Castlemaine Mail,VIC,1917 - 1918,2013-10-06,20131006082228
121,Children's Newspaper (NSW : 1899 - 1900),Children's Newspaper,NSW,1899 - 1900,2013-10-06,20131006082228
541,Chiltern and Howlong Times and Ovens Register (Vic. : 1914 - 1918),Chiltern and Howlong Times and Ovens Register,VIC,1914 - 1918,2013-10-06,20131006082228
490,Clarence River Advocate (NSW : 1898 - 1949),Clarence River Advocate,NSW,1898 - 1949,2013-10-06,20131006082228
626,Clear Hills Standard and Daysdale and Saverneke Times (NSW : 1914),Clear Hills Standard and Daysdale and Saverneke Times,NSW,1914,2013-10-06,20131006082228
542,Clunes Guardian and Gazette (Vic. : 1918 - 1918),Clunes Guardian and Gazette,VIC,1918 - 1918,2013-10-06,20131006082228
543,Cobden Times  (Vic. : 1918),Cobden Times,VIC,1918,2013-10-06,20131006082228
544,Cobden Times and Heytesbury Advertiser (Vic. : 1914 - 1918),Cobden Times and Heytesbury Advertiser,VIC,1914 - 1918,2013-10-06,20131006082228
545,Cobram Courier (Vic. : 1914 - 1918),Cobram Courier,VIC,1914 - 1918,2013-10-06,20131006082228
546,Cohuna Farmer's Weekly (Vic. : 1914 - 1918),Cohuna Farmer's Weekly,VIC,1914 - 1918,2013-10-06,20131006082228
547,Coleraine Albion and Western Advertiser (Vic. : 1914 - 1918),Coleraine Albion and Western Advertiser,VIC,1914 - 1918,2013-10-06,20131006082228
449,Construction and Local Government Journal (NSW : 1913 - 1930),Construction and Local Government Journal,NSW,1913 - 1930,2013-10-06,20131006082228
676,"Country Life Stock & Station Journal (Sydney, NSW : 1924 - 1925)",Country Life Stock & Station Journal,"Sydney, NSW",1924 - 1925,2013-10-06,20131006082228
550,Creswick Advertiser (Vic. : 1914 - 1918),Creswick Advertiser,VIC,1914 - 1918,2013-10-06,20131006082228
442,"Cumberland Argus (Parramatta, NSW : 1950 - 1962)",Cumberland Argus,"Parramatta, NSW",1950 - 1962,2013-10-06,20131006082228
395,"Daily Herald (Adelaide, SA : 1910 - 1924)",Daily Herald,"Adelaide, SA",1910 - 1924,2013-10-06,20131006082228
628,"Daily Witness (Young, NSW : 1913 -1923)",Daily Witness,"Young, NSW",1913 - 1923,2013-10-06,20131006082228
551,"Daylesford Advocate, Yandoit, Glenlyon and Eganstown Chronicle (Vic. : 1914 - 1918)","Daylesford Advocate, Yandoit, Glenlyon and Eganstown Chronicle",VIC,1914 - 1918,2013-10-06,20131006082228
532,Delegate Argus (NSW : 1906 - 1943),Delegate Argus,NSW,1906 - 1943,2013-10-06,20131006082228
450,Delegate Argus and Border Post (NSW : 1895 - 1906),Delegate Argus and Border Post,NSW,1895 - 1906,2013-10-06,20131006082228
507,"Direct Action (Sydney, NSW : 1914 - 1930)",Direct Action,"Sydney, NSW",1914 - 1930,2013-10-06,20131006082228
552,Donald Times (Vic. : 1915 - 1918),Donald Times,VIC,1915 - 1918,2013-10-06,20131006082228
188,Dubbo Liberal and Macquarie Advocate (NSW : 1892 - 1954),Dubbo Liberal and Macquarie Advocate,NSW,1892 - 1954,2013-10-06,20131006082228
201,"Elsternwick Leader and East Brighton, ... (Vic. : 1887)","Elsternwick Leader and East Brighton, ...",VIC,1887,2013-10-06,20131006082228
508,"Evening News (Sydney, NSW : 1869 - 1931)",Evening News,"Sydney, NSW",1869 - 1931,2013-10-06,20131006082228
451,Farmer and Settler (NSW : 1906 - 1957),Farmer and Settler,NSW,1906 - 1957,2013-10-06,20131006082228
556,Foster and Toora Mirror and South Gippsland Shire Advocate (Vic. : 1914),Foster and Toora Mirror and South Gippsland Shire Advocate,VIC,1914,2013-10-06,20131006082228
557,Foster Mirror and South Gippsland Shire Advocate (Vic. : 1914 - 1918),Foster Mirror and South Gippsland Shire Advocate,VIC,1914 - 1918,2013-10-06,20131006082228
558,Geelong Advertiser (Vic. : 1914 - 1918),Geelong Advertiser,VIC,1914 - 1918,2013-10-06,20131006082228
410,Gilgandra Weekly and Castlereagh (NSW : 1929 - 1942),Gilgandra Weekly and Castlereagh,NSW,1929 - 1942,2013-10-06,20131006082228
559,"Gippsland Independent, Buln Buln, Warragul, Berwick, Poowong & Jeetho Shire Advocate (Vic. : 1914 - 1918)","Gippsland Independent, Buln Buln, Warragul, Berwick, Poowong & Jeetho Shire Advocate",VIC,1914 - 1918,2013-10-06,20131006082228
560,Gippsland Standard and Alberton Shire Representative (Vic. : 1914 - 1918),Gippsland Standard and Alberton Shire Representative,VIC,1914 - 1918,2013-10-06,20131006082228
561,Gippslander and Mirboo Times (Vic. : 1914 - 1918),Gippslander and Mirboo Times,VIC,1914 - 1918,2013-10-06,20131006082228
562,Gisborne Gazette (Vic. : 1914 - 1918),Gisborne Gazette,VIC,1914 - 1918,2013-10-06,20131006082228
563,"Glengarry, Toongabbie & Cowwarr Journal and Central Gippsland Reporter (Vic. : 1914)","Glengarry, Toongabbie & Cowwarr Journal and Central Gippsland Reporter",VIC,1914,2013-10-06,20131006082228
564,"Gordon, Egerton and Ballan Advertiser (Vic. : 1914 - 1918)","Gordon, Egerton and Ballan Advertiser",VIC,1914 - 1918,2013-10-06,20131006082228
415,Goulburn Chronicle and Southern Advertiser (NSW : 1860 - 1861),Goulburn Chronicle and Southern Advertiser,NSW,1860 - 1861,2013-10-06,20131006082228
367,Goulburn Herald (NSW : 1881 - 1907),Goulburn Herald,NSW,1881 - 1907,2013-10-06,20131006082228
474,Grenfell Record and Lachlan District Advertiser (NSW : 1876 - 1948),Grenfell Record and Lachlan District Advertiser,NSW,1876 - 1948,2013-10-06,20131006082228
566,Grenville Standard (Vic. : 1915 - 1918),Grenville Standard,VIC,1915 - 1918,2013-10-06,20131006082228
486,"Gundagai Independent and Pastoral, Agricultural & Mining Advocate (NSW : 1898 - 1928)","Gundagai Independent and Pastoral, Agricultural & Mining Advocate",NSW,1898 - 1928,2013-10-06,20131006082228
487,"Gundagai Times and Tumut, Adelong and Murrumbidgee District Advertiser (NSW : 1868 - 1931)","Gundagai Times and Tumut, Adelong and Murrumbidgee District Advertiser",NSW,1868 - 1931,2013-10-06,20131006082228
567,Hamilton Spectator (Vic. : 1914 - 1918),Hamilton Spectator,VIC,1914 - 1918,2013-10-06,20131006082228
488,Hebrew Standard of Australasia (NSW : 1895 - 1953),Hebrew Standard of Australasia,NSW,1895 - 1953,2013-10-06,20131006082228
396,"Herald (Adelaide, SA : 1899 - 1910)",Herald,"Adelaide, SA",1899 - 1910,2013-10-06,20131006082228
568,Heyfield Herald (Vic. : 1914 - 1918),Heyfield Herald,VIC,1914 - 1918,2013-10-06,20131006082228
489,Hillston Spectator and Lachlan River Advertiser (NSW : 1898 - 1953),Hillston Spectator and Lachlan River Advertiser,NSW,1898 - 1953,2013-10-06,20131006082228
569,Hopetoun Courier and Mallee Pioneer (Vic. : 1914 - 1918),Hopetoun Courier and Mallee Pioneer,VIC,1914 - 1918,2013-10-06,20131006082228
669,"Illawarra Mercury (Wollongong, NSW : 1856 - 1950)",Illawarra Mercury,"Wollongong, NSW",1856 - 1950,2013-10-06,20131006082228
570,Inglewood Advertiser (Vic. : 1914 - 1918),Inglewood Advertiser,VIC,1914 - 1918,2013-10-06,20131006082228
624,"Intelligence (Bowral, NSW : 1884)",Intelligence,"Bowral, NSW",1884,2013-10-06,20131006082228
491,"International Socialist (Sydney, NSW : 1910 - 1920)",International Socialist,"Sydney, NSW",1910 - 1920,2013-10-06,20131006082228
376,Ipswich Herald & General Advertiser (Qld. : 1861),Ipswich Herald & General Advertiser,QLD,1861,2013-10-06,20131006082228
397,Kadina and Wallaroo Times (SA : 1888 - 1954),Kadina and Wallaroo Times,SA,1888 - 1954,2013-10-06,20131006082228
398,Kapunda Herald (SA : 1878 - 1951),Kapunda Herald,SA,1878 - 1951,2013-10-06,20131006082228
399,Kapunda Herald and Northern Intelligencer (SA : 1864 - 1878),Kapunda Herald and Northern Intelligencer,SA,1864 - 1878,2013-10-06,20131006082228
360,Kiama Independent and Illawarra and Shoalhaven Advertiser (NSW : 1863),Kiama Independent and Illawarra and Shoalhaven Advertiser,NSW,1863,2013-10-06,20131006082228
572,"Kooweerup Sun, Lang Lang Guardian and Cranbourne Shire Record  (Vic. : 1918)","Kooweerup Sun, Lang Lang Guardian and Cranbourne Shire Record",VIC,1918,2013-10-06,20131006082228
573,Koroit Sentinel and Tower Hill Advocate (Vic. : 1914 - 1918),Koroit Sentinel and Tower Hill Advocate,VIC,1914 - 1918,2013-10-06,20131006082228
575,Kyneton Guardian (Vic. : 1914 - 1918),Kyneton Guardian,VIC,1914 - 1918,2013-10-06,20131006082228
576,Lancefield Mercury and West Bourke Agricultural Record (Vic. : 1914 - 1918),Lancefield Mercury and West Bourke Agricultural Record,VIC,1914 - 1918,2013-10-06,20131006082228
577,Lang Lang Guardian  (Vic. : 1914 - 1918),Lang Lang Guardian,VIC,1914 - 1918,2013-10-06,20131006082228
578,"Lismore, Derrinallum and Cressy Advertiser (Vic. : 1914 - 1918)","Lismore, Derrinallum and Cressy Advertiser",VIC,1914 - 1918,2013-10-06,20131006082228
492,Maitland Daily Mercury (NSW : 1894 - 1939),Maitland Daily Mercury,NSW,1894 - 1939,2013-10-06,20131006082228
629,Maitland Mercury (NSW : 1939),Maitland Mercury,NSW,1939,2013-10-06,20131006082228
493,Maitland Weekly Mercury (NSW : 1894 - 1931),Maitland Weekly Mercury,NSW,1894 - 1931,2013-10-06,20131006082228
510,"Manaro Mercury, and Cooma and Bombala Advertiser (NSW : 1862 - 1931)","Manaro Mercury, and Cooma and Bombala Advertiser",NSW,1862 - 1931,2013-10-06,20131006082228
441,"Mirror (Sydney, NSW : 1917 - 1919)",Mirror,"Sydney, NSW",1917 - 1919,2013-10-06,20131006082228
425,Molong Express and Western District Advertiser (NSW : 1887 - 1954),Molong Express and Western District Advertiser,NSW,1887 - 1954,2013-10-06,20131006082228
494,Moree Gwydir Examiner and General Advertiser (NSW : 1901 - 1940),Moree Gwydir Examiner and General Advertiser,NSW,1901 - 1940,2013-10-06,20131006082228
581,Mortlake Dispatch (Vic. : 1914 - 1918),Mortlake Dispatch,VIC,1914 - 1918,2013-10-06,20131006082228
511,Moruya Times and South Coast Journal (NSW : 1888 - 1915),Moruya Times and South Coast Journal,NSW,1888 - 1915,2013-10-06,20131006082228
582,Mount. Alexander Mail (Vic. : 1914 - 1917),Mount. Alexander Mail,VIC,1914 - 1917,2013-10-06,20131006082228
673,Mullumbimby Star & Byron Bay-Bangalow Advocate (NSW : 1936),Mullumbimby Star & Byron Bay-Bangalow Advocate,NSW,1936,2013-10-06,20131006082228
495,Mullumbimby Star (NSW : 1906 - 1936),Mullumbimby Star,NSW,1906 - 1936,2013-10-06,20131006082228
400,"Murray Pioneer (Renmark, SA : 1942 - 1950)",Murray Pioneer,"Renmark, SA",1942 - 1950,2013-10-06,20131006082228
401,"Murray Pioneer and Australian River Record (Renmark, SA : 1913 - 1942)",Murray Pioneer and Australian River Record,"Renmark, SA",1913 - 1942,2013-10-06,20131006082228
512,Murrurundi Times and Liverpool Plains Gazette (NSW : 1888 - 1929),Murrurundi Times and Liverpool Plains Gazette,NSW,1888 - 1929,2013-10-06,20131006082228
469,Muswellbrook Chronicle (NSW : 1898 - 1955),Muswellbrook Chronicle,NSW,1898 - 1955,2013-10-06,20131006082228
584,Myrtleford Mail and Whorouly Witness (Vic. : 1914 - 1918),Myrtleford Mail and Whorouly Witness,VIC,1914 - 1918,2013-10-06,20131006082228
586,Narracan Shire Advocate (Vic. : 1914 - 1918),Narracan Shire Advocate,VIC,1914 - 1918,2013-10-06,20131006082228
354,Newcastle Chronicle (NSW : 1866 - 1876),Newcastle Chronicle,NSW,1866 - 1876,2013-10-06,20131006082228
353,Newcastle Chronicle and Hunter River District News (NSW : 1859 - 1866),Newcastle Chronicle and Hunter River District News,NSW,1859 - 1866,2013-10-06,20131006082228
461,"News (Adelaide, SA : 1923 - 1954)",News,"Adelaide, SA",1923 - 1954,2013-10-06,20131006082228
588,Nhill Free Press (Vic. : 1914 - 1918),Nhill Free Press,VIC,1914 - 1918,2013-10-06,20131006082228
589,Northcote Leader (Vic. : 1914 - 1918),Northcote Leader,VIC,1914 - 1918,2013-10-06,20131006082228
496,"Northern Times (Newcastle, NSW : 1857 - 1918)",Northern Times,"Newcastle, NSW",1857 - 1918,2013-10-06,20131006082228
592,Omeo Standard and Mining Gazette (Vic. : 1914 - 1918),Omeo Standard and Mining Gazette,VIC,1914 - 1918,2013-10-06,20131006082228
593,Penshurst Free Press (Vic. : 1914 - 1918),Penshurst Free Press,VIC,1914 - 1918,2013-10-06,20131006082228
497,"People (Sydney, NSW : 1900 - 1919)",People,"Sydney, NSW",1900 - 1919,2013-10-06,20131006082228
402,Petersburg Times (SA : 1887 - 1919),Petersburg Times,SA,1887 - 1919,2013-10-06,20131006082228
515,Picton Post (NSW : 1907 - 1954),Picton Post,NSW,1907 - 1954,2013-10-06,20131006082228
594,Pitfield Banner and Hollybush Times (Vic. : 1914 - 1918),Pitfield Banner and Hollybush Times,VIC,1914 - 1918,2013-10-06,20131006082228
247,Prahran Telegraph (Vic. : 1889 - 1890; 1914 - 1918),Prahran Telegraph,VIC,1889 - 1890; 1914 - 1918,2013-10-06,20131006082228
596,"Punch (Melbourne, Vic. : 1914 - 1918)",Punch,"Melbourne, VIC",1914 - 1918,2013-10-06,20131006082228
597,Quambatook Times (Vic. : 1914 - 1918),Quambatook Times,VIC,1914 - 1918,2013-10-06,20131006082228
83,Queanbeyan Age and General Advertiser (NSW : 1860 - 1867),Queanbeyan Age and General Advertiser,NSW,1860 - 1867,2013-10-06,20131006082228
