title_id,full_title,title,place,dates,capture_date,capture_timestamp
1353,Commonwealth of Australia Gazette. Chemical (National : 1990 - 2007),Commonwealth of Australia Gazette. Chemical,NATIONAL,1990 - 2007,2018-08-19,20180819083143
1364,"Commonwealth of Australia Gazette. Department of Education, Training and Youth Affairs (National : 2001 - 2004)","Commonwealth of Australia Gazette. Department of Education, Training and Youth Affairs",NATIONAL,2001 - 2004,2018-08-19,20180819083143
1327,Commonwealth of Australia Gazette. FOI (National : 1983 - 1987),Commonwealth of Australia Gazette. FOI,NATIONAL,1983 - 1987,2018-08-19,20180819083143
1326,Commonwealth of Australia Gazette. Public Service (National : 1977 - 2007),Commonwealth of Australia Gazette. Public Service,NATIONAL,1977 - 2007,2018-08-19,20180819083143
1328,Commonwealth of Australia Gazette. Purchasing and Disposals (National : 1985 - 1997),Commonwealth of Australia Gazette. Purchasing and Disposals,NATIONAL,1985 - 1997,2018-08-19,20180819083143
1352,Commonwealth of Australia Gazette. Tariff Concessions (National : 1983 - 2004),Commonwealth of Australia Gazette. Tariff Concessions,NATIONAL,1983 - 2004,2018-08-19,20180819083143
1359,Commonwealth of Australia Gazette. Telstra Corporation Limited Supplement (National : 1993 - 1997),Commonwealth of Australia Gazette. Telstra Corporation Limited Supplement,NATIONAL,1993 - 1997,2018-08-19,20180819083143
1362,Job Information Circular (National : 1993 - 1998),Job Information Circular,NATIONAL,1993 - 1998,2018-08-19,20180819083143
1344,Purchasing and Disposals Gazette (National : 1997 - 1998),Purchasing and Disposals Gazette,NATIONAL,1997 - 1998,2018-08-19,20180819083143
1101,Ariah Park News (NSW : 1923 - 1928),Ariah Park News,NSW,1923 - 1928,2018-08-19,20180819083143
1354,Burrangong Argus (NSW : 1864 - 1913),Burrangong Argus,NSW,1864 - 1913,2018-08-19,20180819083143
1368,"Cumberland Mercury (Parramatta, NSW : 1875 - 1895)",Cumberland Mercury,"Parramatta, NSW",1875 - 1895,2018-08-19,20180819083143
1134,"Daily Express (Wagga Wagga, NSW : 1919 - 1930)",Daily Express,"Wagga Wagga, NSW",1919 - 1930,2018-08-19,20180819083143
1342,"Daily Pictorial (Sydney, NSW : 1930 - 1931)",Daily Pictorial,"Sydney, NSW",1930 - 1931,2018-08-19,20180819083143
1297,"Daily Telegraph (Sydney, NSW : 1883 - 1930)",Daily Telegraph,"Sydney, NSW",1883 - 1930,2018-08-19,20180819083143
1347,"Daily Telegraph (Sydney, NSW : 1931 - 1954)",Daily Telegraph,"Sydney, NSW",1931 - 1954,2018-08-19,20180819083143
704,"Guang yi hua bao = The Chinese Australian Herald (Sydney, NSW : 1894 - 1923)",Guang yi hua bao = The Chinese Australian Herald,"Sydney, NSW",1894 - 1923,2018-08-19,20180819083143
423,"Leader (Orange, NSW : 1899 - 1939)",Leader,"Orange, NSW",1899 - 1939,2018-08-19,20180819083143
1348,Mosman Mail (NSW : 1898 - 1906),Mosman Mail,NSW,1898 - 1906,2018-08-19,20180819083143
431,Narrandera Argus and Riverina Advertiser (NSW : 1893 - 1953),Narrandera Argus and Riverina Advertiser,NSW,1893 - 1953,2018-08-19,20180819083143
1346,Sawtell Guardian (NSW : 1971 - 1975),Sawtell Guardian,NSW,1971 - 1975,2018-08-19,20180819083143
1392,"Spectator (Sydney, NSW : 1846)",Spectator,"Sydney, NSW",1846,2018-08-19,20180819083143
1393,"Spectator (Sydney, NSW : 1892)",Spectator,"Sydney, NSW",1892,2018-08-19,20180819083143
1184,"Tung Wah Times (Sydney, NSW : 1902 - 1936)",Tung Wah Times,"Sydney, NSW",1902 - 1936,2018-08-19,20180819083143
1349,Yass Courier (NSW : 1857 - 1929),Yass Courier,NSW,1857 - 1929,2018-08-19,20180819083143
1367,Yass Evening Tribune (NSW : 1899 - 1928),Yass Evening Tribune,NSW,1899 - 1928,2018-08-19,20180819083143
1366,Yass Tribune-Courier (NSW : 1929 - 1954),Yass Tribune-Courier,NSW,1929 - 1954,2018-08-19,20180819083143
1336,Adelaide Independent and Cabinet of Amusement (SA : 1841),Adelaide Independent and Cabinet of Amusement,SA,1841,2018-08-19,20180819083143
1332,"Australasian Sketcher (Adelaide,SA : 1874 - 1885)",Australasian Sketcher,"Adelaide,SA",1874 - 1885,2018-08-19,20180819083143
1337,Examiner (SA : 1853),Examiner,SA,1853,2018-08-19,20180819083143
1338,Free Press (SA : 1895),Free Press,SA,1895,2018-08-19,20180819083143
1335,Gawler Standard (SA : 1878 - 1885),Gawler Standard,SA,1878 - 1885,2018-08-19,20180819083143
1334,Gawler Times (SA : 1869 - 1873),Gawler Times,SA,1869 - 1873,2018-08-19,20180819083143
1340,Illustrated Adelaide Post (SA : 1867 - 1874),Illustrated Adelaide Post,SA,1867 - 1874,2018-08-19,20180819083143
1341,Northern Suburbs Weekly (SA : 1952 - 1954),Northern Suburbs Weekly,SA,1952 - 1954,2018-08-19,20180819083143
1333,Saturday Mail (SA : 1912 - 1917),Saturday Mail,SA,1912 - 1917,2018-08-19,20180819083143
1339,South Australian Free Press (SA : 1853 - 1854),South Australian Free Press,SA,1853 - 1854,2018-08-19,20180819083143
1329,South Australian Record (SA : 1837 - 1840),South Australian Record,SA,1837 - 1840,2018-08-19,20180819083143
1330,South Australian Record and Australasian Chronicle (SA : 1840),South Australian Record and Australasian Chronicle,SA,1840,2018-08-19,20180819083143
1331,South Australian Record and Australasian and South African Chronicle (SA : 1840 - 1841),South Australian Record and Australasian and South African Chronicle,SA,1840 - 1841,2018-08-19,20180819083143
1309,"Western Weekly News (Port Lincoln, SA : 1902-1904)",Western Weekly News,"Port Lincoln, SA",1902 - 1904,2018-08-19,20180819083143
232,Ballarat Courier (Vic. : 1869 - 1882; 1914 - 1918),Ballarat Courier,VIC,1869 - 1882; 1914 - 1918,2018-08-19,20180819083143
1325,"Evening Echo (Ballarat, Vic. : 1914 - 1918)",Evening Echo,"Ballarat, VIC",1914 - 1918,2018-08-19,20180819083143
1190,"Herald (Melbourne, Vic. : 1861 - 1954)",Herald,"Melbourne, VIC",1861 - 1954,2018-08-19,20180819083143
1324,Kyneton Observer (Vic. : 1856 - 1900),Kyneton Observer,VIC,1856 - 1900,2018-08-19,20180819083143
795,"Labor Call (Melbourne, Vic. : 1906 - 1953)",Labor Call,"Melbourne, VIC",1906 - 1953,2018-08-19,20180819083143
250,Lilydale Express (Vic. : 1886 - 1888; 1914 - 1918),Lilydale Express,VIC,1886 - 1888; 1914 - 1918,2018-08-19,20180819083143
1322,"Socialist (Melbourne, Vic. : 1906 - 1923)",Socialist,"Melbourne, VIC",1906 - 1923,2018-08-19,20180819083143
175,Albany Advertiser (WA : 1897 - 1954),Albany Advertiser,WA,1897 - 1954,2018-08-19,20180819083143
1383,"Chung Wah News (Perth, WA : 1981 - 1987)",Chung Wah News,"Perth, WA",1981 - 1987,2018-08-19,20180819083143
1385,"Der Australische Spiegel = The Australian Mirror (Perth, WA : 1952)",Der Australische Spiegel = The Australian Mirror,"Perth, WA",1952,2018-08-19,20180819083143
1384,"Echo : Polski Tygodnik Niezalezny (Perth, WA : 1950 - 1952)",Echo : Polski Tygodnik Niezalezny,"Perth, WA",1950 - 1952,2018-08-19,20180819083143
1387,"Eco Italiano (Perth, WA : 1958 - 1959)",Eco Italiano,"Perth, WA",1958 - 1959,2018-08-19,20180819083143
1389,"Hellenic Echo (Perth, WA : 1967 - 1968)",Hellenic Echo,"Perth, WA",1967 - 1968,2018-08-19,20180819083143
1378,"Il Canguro = The Kangaroo (Perth, WA : 1955 - 1957)",Il Canguro = The Kangaroo,"Perth, WA",1955 - 1957,2018-08-19,20180819083143
1386,"Japanese Perth Times (Subiaco, WA : 1989 - 1996)",Japanese Perth Times,"Subiaco, WA",1989 - 1996,2018-08-19,20180819083143
1388,"La Rondine (Perth, WA : 1969 - 1994)",La Rondine,"Perth, WA",1969 - 1994,2018-08-19,20180819083143
976,"Laverton and Beria Mercury (Laverton, WA : 1899 - 1921)",Laverton and Beria Mercury,"Laverton, WA",1899 - 1921,2018-08-19,20180819083143
1390,"Mediterranean Voice (Perth, WA : 1971 - 1972)",Mediterranean Voice,"Perth, WA",1971 - 1972,2018-08-19,20180819083143
815,Merredin Mercury and Central Districts Index (WA : 1912 - 1954),Merredin Mercury and Central Districts Index,WA,1912 - 1954,2018-08-19,20180819083143
254,"Northern Times (Carnarvon, WA : 1905 - 1954)",Northern Times,"Carnarvon, WA",1905 - 1954,2018-08-19,20180819083143
1090,Pingelly-Brookton Leader (WA : 1925 - 1954),Pingelly-Brookton Leader,WA,1925 - 1954,2018-08-19,20180819083143
1310,"Red Star (Perth, WA : 1932 - 1936)",Red Star,"Perth, WA",1932 - 1936,2018-08-19,20180819083143
1380,"Stampa Italiana = The Italian Press (Perth, WA : 1931 - 1932)",Stampa Italiana = The Italian Press,"Perth, WA",1931 - 1932,2018-08-19,20180819083143
1379,"Sunday Times Edizione Italiana (Perth, WA : 1958 - 1959)",Sunday Times Edizione Italiana,"Perth, WA",1958 - 1959,2018-08-19,20180819083143
1382,"Vesnik (Perth, WA : 1975 - 1994)",Vesnik,"Perth, WA",1975 - 1994,2018-08-19,20180819083143
1381,"Voice of Freedom = Elefthera Phoni (Perth, WA : 1956 - 1957)",Voice of Freedom = Elefthera Phoni,"Perth, WA",1956 - 1957,2018-08-19,20180819083143
1311,"Workers Star (Perth, WA : 1936 - 1951)",Workers Star,"Perth, WA",1936 - 1951,2018-08-19,20180819083143
1372,Papua New Guinea Government Gazette (1971 - 1975),Papua New Guinea Government Gazette,,1971 - 1975,2018-08-19,20180819083143
1376,Papua New Guinea Post-Courier (Port Moresby : 1969 - 1981),Papua New Guinea Post-Courier,Port MORESBY,1969 - 1981,2018-08-19,20180819083143
1369,Territory of Papua Government Gazette (Papua New Guinea : 1906 - 1942),Territory of Papua Government Gazette,Papua New GUINEA,1906 - 1942,2018-08-19,20180819083143
1371,Territory of Papua and New Guinea Government Gazette (1949 - 1971),Territory of Papua and New Guinea Government Gazette,,1949 - 1971,2018-08-19,20180819083143
1370,Territory of Papua-New Guinea Government Gazette (1945 - 1949),Territory of Papua-New Guinea Government Gazette,,1945 - 1949,2018-08-19,20180819083143
1391,Tribune (Philippines : 1932 - 1945),Tribune,PHILIPPINES,1932 - 1945,2018-08-19,20180819083143
1298,Moreton Mail (Qld. : 1886 - 1899),Moreton Mail,QLD,1886 - 1899,2018-09-19,20180919115311
565,"Great Southern Advocate (Korumburra, Vic. : 1889 - 1926)",Great Southern Advocate,"Korumburra, VIC",1889 - 1926,2018-09-19,20180919115311
317,Maryborough and Dunolly Advertiser (Vic. : 1857 - 1867 ; 1914 - 1918),Maryborough and Dunolly Advertiser,VIC,1857 - 1867 ; 1914 - 1918,2018-09-19,20180919115311
1184,"Tung Wah Times (Sydney, NSW : 1901 - 1936)",Tung Wah Times,"Sydney, NSW",1901 - 1936,2018-10-15,20181015070113
565,"Great Southern Advocate (Korumburra, Vic. : 1889 - 1918, 1927-1933)",Great Southern Advocate,"Korumburra, VIC","1889 - 1918, 1927 - 1933",2018-10-15,20181015070113
976,"Laverton and Beria Mercury (Laverton, WA : 1899 - 1919)",Laverton and Beria Mercury,"Laverton, WA",1899 - 1919,2018-10-15,20181015070113
815,Merredin Mercury and Central Districts Index (WA : 1912 - 1921),Merredin Mercury and Central Districts Index,WA,1912 - 1921,2018-10-15,20181015070113
1426,"Wheatbelt Tribune and Koorda Record (Wyalkatchem, WA : 1940 - 1954)",Wheatbelt Tribune and Koorda Record,"Wyalkatchem, WA",1940 - 1954,2018-10-15,20181015070113
1377,Guinea Gold (Papua New Guinea : 1942 - 1945),Guinea Gold,Papua New GUINEA,1942 - 1945,2018-10-15,20181015070113
1375,"Papuan Courier (Port Moresby, Papua New Guinea : 1917 - 1942)",Papuan Courier,"Port Moresby, Papua New GUINEA",1917 - 1942,2018-10-15,20181015070113
1373,"Papuan Times (Kwato, Papua New Guinea : 1951 - 1954)",Papuan Times,"Kwato, Papua New GUINEA",1951 - 1954,2018-10-15,20181015070113
1461,"Bent's News and New South Wales Advertiser (Sydney, NSW : 1839)",Bent's News and New South Wales Advertiser,"Sydney, NSW",1839,2018-11-28,20181128142559
1469,"Daily News and Evening Chronicle (Sydney, NSW : 1848)",Daily News and Evening Chronicle,"Sydney, NSW",1848,2018-11-28,20181128142559
1470,"Gleaner (Sydney, NSW : 1827)",Gleaner,"Sydney, NSW",1827,2018-11-28,20181128142559
431,Narandera Argus and Riverina Advertiser (NSW : 1893 - 1953,Narandera Argus and Riverina Advertiser (NSW : 1893 - 1953,,,2018-11-28,20181128142559
1476,New South Wales Police Gazette and Weekly Record of Crime (Sydney : 1862 - 1930),New South Wales Police Gazette and Weekly Record of Crime,SYDNEY,1862 - 1930,2018-11-28,20181128142559
1471,"People's Advocate and New South Wales Vindicator (Sydney, NSW : 1848-1856)",People's Advocate and New South Wales Vindicator,"Sydney, NSW",1848 - 1856,2018-11-28,20181128142559
1346,Sawtell Guardian (NSW : 1970 - 1975),Sawtell Guardian,NSW,1970 - 1975,2018-11-28,20181128142559
1463,Sydney Journal and Daily Advertiser (NSW : 1847),Sydney Journal and Daily Advertiser,NSW,1847,2018-11-28,20181128142559
1473,Sydney Standard and Colonial Advocate (NSW : 1839),Sydney Standard and Colonial Advocate,NSW,1839,2018-11-28,20181128142559
1298,"Moreton Mail (Qld. : 1886 - 1899, 1930 - 1935)",Moreton Mail,QLD,"1886 - 1899, 1930 - 1935",2018-11-28,20181128142559
1479,"Messenger (Port Adelaide, SA : 1951 - 1954)",Messenger,"Port Adelaide, SA",1951 - 1954,2018-11-28,20181128142559
1478,Port Augusta and Stirling Illustrated News (SA : 1901),Port Augusta and Stirling Illustrated News,SA,1901,2018-11-28,20181128142559
1477,"Portonian (Port Adelaide, SA : 1871 - 1873)",Portonian,"Port Adelaide, SA",1871 - 1873,2018-11-28,20181128142559
1430,Albany Despatch (WA : 1919 - 1927),Albany Despatch,WA,1919 - 1927,2018-11-28,20181128142559
1400,Bulong Bulletin and Mining Register (WA : 1897 - 1898),Bulong Bulletin and Mining Register,WA,1897 - 1898,2018-11-28,20181128142559
1404,Coolgardie Pioneer (WA : 1895 - 1901),Coolgardie Pioneer,WA,1895 - 1901,2018-11-28,20181128142559
1408,Day Dawn Chronicle (WA : 1902 - 1909),Day Dawn Chronicle,WA,1902 - 1909,2018-11-28,20181128142559
1415,Geraldton Guardian (WA : 1951 - 1954),Geraldton Guardian,WA,1951 - 1954,2018-11-28,20181128142559
1419,Harvey Murray Times (WA : 1931 - 1954),Harvey Murray Times,WA,1931 - 1954,2018-11-28,20181128142559
1420,"Hedland Advocate (Port Hedland, WA : 1906 - 1912)",Hedland Advocate,"Port Hedland, WA",1906 - 1912,2018-11-28,20181128142559
1421,"Herald (Coolgardie, WA : 1899 - 1901)",Herald,"Coolgardie, WA",1899 - 1901,2018-11-28,20181128142559
1428,"Irwin Index (Mingenew, WA : 1926 - 1956)",Irwin Index,"Mingenew, WA",1926 - 1956,2018-11-28,20181128142559
1454,Kookynie Press (WA : 1903 - 1911),Kookynie Press,WA,1903 - 1911,2018-11-28,20181128142559
1452,Manjimup Mail and Jardee-Pemberton-Northcliffe Press (WA : 1927 - 1950),Manjimup Mail and Jardee-Pemberton-Northcliffe Press,WA,1927 - 1950,2018-11-28,20181128142559
1451,"Midlands Advocate (Perth, WA : 1930 - 1954)",Midlands Advocate,"Perth, WA",1930 - 1954,2018-11-28,20181128142559
1450,"Morgans Courier (Mount Morgan, WA : 1904 - 1911)",Morgans Courier,"Mount Morgan, WA",1904 - 1911,2018-11-28,20181128142559
1445,Narrogin Advocate and Southern Districts Courier (WA : 1904 - 1906),Narrogin Advocate and Southern Districts Courier,WA,1904 - 1906,2018-11-28,20181128142559
1444,Newcastle Herald and Toodyay District Chronicle (WA : 1902 - 1912),Newcastle Herald and Toodyay District Chronicle,WA,1902 - 1912,2018-11-28,20181128142559
1443,"North-Eastern Wheatbelt Tribune (Wyalkatchem, WA : 1926 - 1940)",North-Eastern Wheatbelt Tribune,"Wyalkatchem, WA",1926 - 1940,2018-11-28,20181128142559
1435,"Western Australian Goldfields Courier (Coolgardie, WA : 1894 - 1898)",Western Australian Goldfields Courier,"Coolgardie, WA",1894 - 1898,2018-11-28,20181128142559
1374,"Papuan Times (Port Moresby, Papua New Guinea : 1911 - 1916)",Papuan Times,"Port Moresby, Papua New GUINEA",1911 - 1916,2018-11-28,20181128142559
436,Albury Banner and Wodonga Express (NSW : 1881 - 1895),Albury Banner and Wodonga Express,NSW,1881 - 1895,2019-03-22,20190322093705
1465,"Alfred (Sydney, NSW : 1835)",Alfred,"Sydney, NSW",1835,2019-03-22,20190322093705
1466,"Australian Sportsman (Sydney, NSW : 1848)",Australian Sportsman,"Sydney, NSW",1848,2019-03-22,20190322093705
1467,"Citizen (Sydney, NSW : 1846 - 1847)",Citizen,"Sydney, NSW",1846 - 1847,2019-03-22,20190322093705
1468,"Currency Lad (Sydney, NSW : 1832-1833)",Currency Lad,"Sydney, NSW",1832 - 1833,2019-03-22,20190322093705
1462,"Hill's Life in New South Wales (Sydney, NSW : 1832)",Hill's Life in New South Wales,"Sydney, NSW",1832,2019-03-22,20190322093705
280,"Meie Kodu = Our Home (Sydney, NSW : 1949 - 1956)",Meie Kodu = Our Home,"Sydney, NSW",1949 - 1956,2019-03-22,20190322093705
1480,"Mosman, Neutral and Middle Harbour Resident (NSW : 1904 - 1907, 1919)","Mosman, Neutral and Middle Harbour Resident",NSW,"1904 - 1907, 1919",2019-03-22,20190322093705
1476,New South Wales Police Gazette and Weekly Record of Crime (Sydney : 1860 - 1930),New South Wales Police Gazette and Weekly Record of Crime,SYDNEY,1860 - 1930,2019-03-22,20190322093705
1472,Sydney Daily Advertiser (NSW : 1848),Sydney Daily Advertiser,NSW,1848,2019-03-22,20190322093705
1464,Sydney Punch (NSW : 1864 - 1888),Sydney Punch,NSW,1864 - 1888,2019-03-22,20190322093705
1474,Sydney Times (NSW : 1834-1838),Sydney Times,NSW,1834 - 1838,2019-03-22,20190322093705
1475,Sydney Weekly Transcript (NSW : 1846),Sydney Weekly Transcript,NSW,1846,2019-03-22,20190322093705
1490,"Weekly Observer (Sydney, NSW : 1833)",Weekly Observer,"Sydney, NSW",1833,2019-03-22,20190322093705
1349,Yass Courier (NSW : 1902 - 1929),Yass Courier,NSW,1902 - 1929,2019-03-22,20190322093705
1482,Toowoomba Chronicle (Qld. : 1917 - 1922),Toowoomba Chronicle,QLD,1917 - 1922,2019-03-22,20190322093705
1481,Toowoomba Chronicle and Darling Downs Gazette (Qld. : 1922 - 1933),Toowoomba Chronicle and Darling Downs Gazette,QLD,1922 - 1933,2019-03-22,20190322093705
1484,"Egotist (Adelaide, SA : 1839 - 1854)",Egotist,"Adelaide, SA",1839 - 1854,2019-03-22,20190322093705
1341,Northern Suburbs Weekly (SA : 1952 - 1961),Northern Suburbs Weekly,SA,1952 - 1961,2019-03-22,20190322093705
1485,Port Lincoln Herald (SA : 1839 - 1840),Port Lincoln Herald,SA,1839 - 1840,2019-03-22,20190322093705
1486,"Tribune (SA edition, published in Sydney : 1951 - 1964)",Tribune,"SA edition, published in SYDNEY",1951 - 1964,2019-03-22,20190322093705
1487,Western People and Tumby Bay Times (SA : 1912),Western People and Tumby Bay Times,SA,1912,2019-03-22,20190322093705
232,Ballarat Courier (Vic. : 1869 - 1883; 1914 - 1918),Ballarat Courier,VIC,1869 - 1883; 1914 - 1918,2019-03-22,20190322093705
717,Benalla Standard (Vic. : 1901 - 1931),Benalla Standard,VIC,1901 - 1931,2019-03-22,20190322093705
1483,Elmore Standard (Vic. : 1882 - 1905),Elmore Standard,VIC,1882 - 1905,2019-03-22,20190322093705
319,"Leader (Melbourne, Vic. : 1862 - 1918, 1935)",Leader,"Melbourne, VIC","1862 - 1918, 1935",2019-03-22,20190322093705
250,Lilydale Express (Vic. : 1886 - 1897 ; 1914 - 1918),Lilydale Express,VIC,1886 - 1897 ; 1914 - 1918,2019-03-22,20190322093705
332,Melton Express (Vic. : 1915 - 1943),Melton Express,VIC,1915 - 1943,2019-03-22,20190322093705
305,"Ouyen Mail (Vic. : 1915 - 1918, 1931 - 1941)",Ouyen Mail,VIC,"1915 - 1918, 1931 - 1941",2019-03-22,20190322093705
599,Richmond Australian (Vic. : 1912 - 1916),Richmond Australian,VIC,1912 - 1916,2019-03-22,20190322093705
310,Richmond Guardian (Vic. : 1907 - 1918),Richmond Guardian,VIC,1907 - 1918,2019-03-22,20190322093705
383,"Telegraph, St Kilda, Prahran and South Yarra Guardian (Vic. : 1864 - 1888)","Telegraph, St Kilda, Prahran and South Yarra Guardian",VIC,1864 - 1888,2019-03-22,20190322093705
1394,Avon Argus and Cunderdin-Meckering-Tammin Mail (WA : 1925 - 1954),Avon Argus and Cunderdin-Meckering-Tammin Mail,WA,1925 - 1954,2019-03-22,20190322093705
1395,Ballidu-Wongan Budget (WA : 1927 - 1941),Ballidu-Wongan Budget,WA,1927 - 1941,2019-03-22,20190322093705
1396,Blackwood Chronicle and South-West Mining News (WA : 1904 - 1907),Blackwood Chronicle and South-West Mining News,WA,1904 - 1907,2019-03-22,20190322093705
1398,Bridgetown Advocate (WA : 1938 - 1950),Bridgetown Advocate,WA,1938 - 1950,2019-03-22,20190322093705
1413,"Farmers Observer (Narembeen, WA : 1933 - 1935)",Farmers Observer,"Narembeen, WA",1933 - 1935,2019-03-22,20190322093705
1414,Geraldton Advertiser (WA : 1893 - 1905),Geraldton Advertiser,WA,1893 - 1905,2019-03-22,20190322093705
1415,Geraldton Guardian (WA : 1950 - 1954),Geraldton Guardian,WA,1950 - 1954,2019-03-22,20190322093705
1422,Lake Grace Newdegate Cultivator and Dumbleyung and Kukerin Producer (WA : 1925 - 1930),Lake Grace Newdegate Cultivator and Dumbleyung and Kukerin Producer,WA,1925 - 1930,2019-03-22,20190322093705
1448,Mount Morgans Mercury (WA : 1906 - 1909),Mount Morgans Mercury,WA,1906 - 1909,2019-03-22,20190322093705
1447,Mount Morgans Miner (WA : 1901 - 1903),Mount Morgans Miner,WA,1901 - 1903,2019-03-22,20190322093705
1446,Narembeen Observer (WA : 1928 - 1933),Narembeen Observer,WA,1928 - 1933,2019-03-22,20190322093705
1439,"South Western Times (Bunbury, WA : 1932 - 1954)",South Western Times,"Bunbury, WA",1932 - 1954,2019-03-22,20190322093705
1438,"South Western Tribune (Bunbury, WA : 1930 - 1932)",South Western Tribune,"Bunbury, WA",1930 - 1932,2019-03-22,20190322093705
1434,Wiluna Chronicle and East Murchison Advocate (WA : 1924 - 1931),Wiluna Chronicle and East Murchison Advocate,WA,1924 - 1931,2019-03-22,20190322093705
1425,Wongan-Ballidu Budget (WA : 1941 - 1954),Wongan-Ballidu Budget,WA,1941 - 1954,2019-03-22,20190322093705
1433,Wyalkatchem Wheatsheaf and Bencubbin Banner (WA : 1922 - 1939),Wyalkatchem Wheatsheaf and Bencubbin Banner,WA,1922 - 1939,2019-03-22,20190322093705
1432,York Chronicle (WA : 1927 - 1954),York Chronicle,WA,1927 - 1954,2019-03-22,20190322093705
1488,Bangkok Recorder (Thailand : 1865 - 1867),Bangkok Recorder,THAILAND,1865 - 1867,2019-03-22,20190322093705
436,Albury Banner and Wodonga Express (NSW : 1881 - 1938),Albury Banner and Wodonga Express,NSW,1881 - 1938,2019-05-19,20190519173657
1354,Burrangong Argus (NSW : 1865 - 1913),Burrangong Argus,NSW,1865 - 1913,2019-05-19,20190519173657
423,"Leader (Orange, NSW : 1899 - 1945)",Leader,"Orange, NSW",1899 - 1945,2019-05-19,20190519173657
1346,Sawtell Guardian (NSW : 1970 - 1976),Sawtell Guardian,NSW,1970 - 1976,2019-05-19,20190519173657
1489,"Torres News (Thursday Island, Qld. : 1957-2015)",Torres News,"Thursday Island, QLD",1957 - 2015,2019-05-19,20190519173657
1429,Albany Observer (WA : 1890 - 1891),Albany Observer,WA,1890 - 1891,2019-05-19,20190519173657
1397,Bonnie Rock-Lake Brown-Mukinbudin Leader (WA : 1934 - 1939),Bonnie Rock-Lake Brown-Mukinbudin Leader,WA,1934 - 1939,2019-05-19,20190519173657
1405,Corrigin Broadcaster and Peoples Weekly (WA : 1930 - 1933),Corrigin Broadcaster and Peoples Weekly,WA,1930 - 1933,2019-05-19,20190519173657
1407,"Dampier Despatch (Broome, WA : 1904 - 1905)",Dampier Despatch,"Broome, WA",1904 - 1905,2019-05-19,20190519173657
1411,East Murchison News (WA : 1901 - 1911),East Murchison News,WA,1901 - 1911,2019-05-19,20190519173657
1412,Esperance Times (WA : 1896 - 1898),Esperance Times,WA,1896 - 1898,2019-05-19,20190519173657
1491,Fremantle Advocate (WA : 1926 - 1942),Fremantle Advocate,WA,1926 - 1942,2019-05-19,20190519173657
1417,Gnowangerup Star (WA : 1942 - 1954),Gnowangerup Star,WA,1942 - 1954,2019-05-19,20190519173657
1418,Greenbushes Advocate and Donnybrook and Bridgetown Advertiser (WA : 1899 - 1902),Greenbushes Advocate and Donnybrook and Bridgetown Advertiser,WA,1899 - 1902,2019-05-19,20190519173657
1424,Nelson Advocate (WA : 1926 - 1938),Nelson Advocate,WA,1926 - 1938,2019-05-19,20190519173657
1497,"Northern Times (Carnarvon, WA : 1952 - 1954)",Northern Times,"Carnarvon, WA",1952 - 1954,2019-05-19,20190519173657
1441,Perenjori Pioneer (WA : 1930 - 1933),Perenjori Pioneer,WA,1930 - 1933,2019-05-19,20190519173657
1425,Wongan-Ballidu Budget (WA : 1939 - 1954),Wongan-Ballidu Budget,WA,1939 - 1954,2019-05-19,20190519173657
1500,"Bananacoast Opinion (Coffs Harbour, NSW : 1973 - 1978)",Bananacoast Opinion,"Coffs Harbour, NSW",1973 - 1978,2019-06-26,20190626113124
1492,"Border Morning Mail (Albury, NSW : 1938 - 1943)",Border Morning Mail,"Albury, NSW",1938 - 1943,2019-06-26,20190626113124
1493,"North Coast Times (Bellingen and Coffs Harbour, NSW : 1888 - 1889)",North Coast Times,"Bellingen and Coffs Harbour, NSW",1888 - 1889,2019-06-26,20190626113124
1501,"Nota (Hawks Nest and Tea Gardens, NSW : 1970 - 1983)",Nota,"Hawks Nest and Tea Gardens, NSW",1970 - 1983,2019-06-26,20190626113124
1502,"Express, Melton (Vic. 1943 - 1954)","Express, Melton",,Vic. 1943 - 1954,2019-06-26,20190626113124
565,"Great Southern Advocate (Korumburra, Vic. : 1889 - 1906, 1914 - 1918, 1927 - 1933)",Great Southern Advocate,"Korumburra, VIC","1889 - 1906, 1914 - 1918, 1927 - 1933",2019-06-26,20190626113124
1494,Mountain District Free Press (Vic. : 1947 - 1954),Mountain District Free Press,VIC,1947 - 1954,2019-06-26,20190626113124
1498,"A Voz de Timor (Dili, East Timor : 1973 - 1975)",A Voz de Timor,"Dili, East TIMOR",1973 - 1975,2019-06-26,20190626113124
1506,"Yellow Flag and Torrens Island Terror (Adelaide, SA : 1901)",Yellow Flag and Torrens Island Terror,"Adelaide, SA",1901,2019-10-28,20191028052519
1503,"Arena (Melbourne, Vic. : 1900 - 1903)",Arena,"Melbourne, VIC",1900 - 1903,2019-10-28,20191028052519
1504,"Arena-Sun (Melbourne, Vic. : 1903 - 1904)",Arena-Sun,"Melbourne, VIC",1903 - 1904,2019-10-28,20191028052519
246,Bacchus Marsh Express (Vic. : 1866 - 1945),Bacchus Marsh Express,VIC,1866 - 1945,2019-10-28,20191028052519
1495,Chiltern Leader (Vic. : 1896 - 1898),Chiltern Leader,VIC,1896 - 1898,2019-10-28,20191028052519
1483,Elmore Standard (Vic. : 1882 - 1910),Elmore Standard,VIC,1882 - 1910,2019-10-28,20191028052519
565,"Great Southern Advocate (Korumburra, Vic. : 1889 - 1906, 1914 - 1934)",Great Southern Advocate,"Korumburra, VIC","1889 - 1906, 1914 - 1934",2019-10-28,20191028052519
250,Lilydale Express (Vic. : 1886 - 1897 ; 1914 - 1920),Lilydale Express,VIC,1886 - 1897 ; 1914 - 1920,2019-10-28,20191028052519
243,"Lilydale Express and Yarra Glen, Wandin Yallock, Upper Yarra, Healesville and Ringwood Chronicle (Vic. : 1900 - 1914)","Lilydale Express and Yarra Glen, Wandin Yallock, Upper Yarra, Healesville and Ringwood Chronicle",VIC,1900 - 1914,2019-10-28,20191028052519
586,"Narracan Shire Advocate (Vic. : 1889, 1914 - 1918)",Narracan Shire Advocate,VIC,"1889, 1914 - 1918",2019-10-28,20191028052519
